<?xml version="1.0" encoding="UTF-8"?>
<page_template xmlns="http://www.xiaocheng.xyz"
               xmlns:xsi="http://www.w3.org/2001/XMLSchema-instance"
               xsi:schemaLocation="http://www.xiaocheng.xyz  ../page_template.xsd">
    <page_name>PC首页</page_name>
    <page_code>eduPCIndex</page_code>
    <children>
        <template>
            <name>焦点图</name>
            <keyword>JiaoDianTu</keyword>
            <type>图片链接</type>
            <count>4</count>
        </template>
        <template>
            <name>分类</name>
            <keyword>category</keyword>
            <type>模板</type>
            <template_num>4</template_num>
            <children>
                <template>
                    <name>标题</name>
                    <keyword>title</keyword>
                    <type>文字链接</type>
                    <count>1</count>
                </template>
                <template>
                    <name>链接</name>
                    <keyword>link</keyword>
                    <type>文字链接</type>
                    <count>15</count>
                </template>
            </children>
        </template>
        <template>
            <name>推荐学校</name>
            <keyword>XueXiao</keyword>
            <type>图片链接</type>
            <count>8</count>
        </template>
        <template>
            <name>推荐专业</name>
            <keyword>ZhuanYe</keyword>
            <type>图片链接</type>
            <count>4</count>
        </template>
        <template>
            <name>热门系别</name>
            <keyword>XiBie</keyword>
            <type>图片链接</type>
            <count>4</count>
        </template>
        <template>
            <name>报考指南</name>
            <keyword>BaoKao</keyword>
            <type>图片链接</type>
            <count>4</count>
        </template>
    </children>
</page_template>