<?xml version="1.0" encoding="UTF-8"?>
<page_template xmlns="http://www.xiaocheng.xyz"
               xmlns:xsi="http://www.w3.org/2001/XMLSchema-instance"
               xsi:schemaLocation="http://www.xiaocheng.xyz  ../page_template.xsd">
    <page_name>公共页头页尾</page_name>
    <page_code>eduCommonData</page_code>
    <children>
        <template>
            <name>头部LOGO</name>
            <keyword>headerLogo</keyword>
            <type>图片链接</type>
            <count>1</count>
        </template>
        <template>
            <name>头部导航</name>
            <keyword>headerLink</keyword>
            <type>文字链接</type>
            <count>6</count>
        </template>
        <template>
            <name>友情链接</name>
            <keyword>friendlyLink</keyword>
            <type>文字链接</type>
            <count>10</count>
        </template>
        <template>
            <name>底部LOGO</name>
            <keyword>footerLogo</keyword>
            <type>图片链接</type>
            <count>1</count>
        </template>
        <template>
            <name>二维码</name>
            <keyword>QRCode</keyword>
            <type>图片链接</type>
            <count>1</count>
        </template>
        <template>
            <name>版权信息</name>
            <keyword>copyright</keyword>
            <type>文字链接</type>
            <count>1</count>
        </template>
        <template>
            <name>底部菜单</name>
            <keyword>footer</keyword>
            <type>模板</type>
            <template_num>4</template_num>
            <children>
                <template>
                    <name>标题</name>
                    <keyword>title</keyword>
                    <type>文字链接</type>
                    <count>1</count>
                </template>
                <template>
                    <name>链接</name>
                    <keyword>link</keyword>
                    <type>文字链接</type>
                    <count>4</count>
                </template>
            </children>
        </template>
    </children>
</page_template>