<?xml version="1.0" encoding="UTF-8"?>
<page_template xmlns="http://www.xiaocheng.xyz"
               xmlns:xsi="http://www.w3.org/2001/XMLSchema-instance"
               xsi:schemaLocation="http://www.xiaocheng.xyz  ../page_template.xsd">
    <page_name>H5首页</page_name>
    <page_code>WapIndex</page_code>
    <children>
        <template>
            <name>焦点图</name>
            <keyword>JiaoDianTu</keyword>
            <type>图片链接</type>
            <count>4</count>
        </template>
        <template>
            <name>入口图标</name>
            <keyword>RuKouTuBiao</keyword>
            <type>图片链接</type>
            <intro>名称为商品名称，标题为新品标签，子标题为用户评论，扩展属性为商品标签</intro>
            <count>4</count>
        </template>
        <template>
            <name>活动</name>
            <keyword>HuoDong</keyword>
            <type>模板</type>
            <template_num>3</template_num>
            <children>
                <template>
                    <name>标题</name>
                    <keyword>BiaoTi</keyword>
                    <type>文字链接</type>
                    <count>1</count>
                </template>
                <template>
                    <name>轮播图</name>
                    <keyword>LunBoTu</keyword>
                    <type>图片链接</type>
                    <count>4</count>
                </template>
                <template>
                    <name>查看全部</name>
                    <keyword>QuanBu</keyword>
                    <type>文字链接</type>
                    <count>1</count>
                </template>
            </children>
        </template>
        <template>
            <name>清单</name>
            <keyword>QingDan</keyword>
            <type>模板</type>
            <children>
                <template>
                    <name>标题</name>
                    <keyword>BiaoTi</keyword>
                    <type>文字链接</type>
                    <count>1</count>
                </template>
                <template>
                    <name>图片</name>
                    <keyword>TuPian</keyword>
                    <type>图片链接</type>
                    <count>4</count>
                </template>
                <template>
                    <name>查看全部</name>
                    <keyword>QuanBu</keyword>
                    <type>文字链接</type>
                    <count>1</count>
                </template>
            </children>
        </template>
        <template>
            <name>商品</name>
            <keyword>ShangPin</keyword>
            <type>模板</type>
            <children>
                <template>
                    <name>标题</name>
                    <keyword>BiaoTi</keyword>
                    <type>文字链接</type>
                    <count>1</count>
                </template>
                <template>
                    <name>文章</name>
                    <keyword>Article</keyword>
                    <type>文章</type>
                    <count>4</count>
                </template>
                <template>
                    <name>查看全部</name>
                    <keyword>QuanBu</keyword>
                    <type>文字链接</type>
                    <count>1</count>
                </template>
            </children>
        </template>
    </children>
</page_template>